{
  "id": "a2a",
  "name": "Agent2Agent Protocol",
  "abbreviation": "A2A",
  "layer": "agent",
  "connects": "A client agent to a remote agent that it hands tasks to.",
  "author": "Google",
  "steward": "Agentic AI Foundation (Linux Foundation)",
  "status": "active",
  "version": "1.0.0",
  "released": "2026-03-12",
  "versioning": "semver",
  "spec": "https://a2a-protocol.org/latest/specification/",
  "repository": "https://github.com/a2aproject/A2A",
  "schema": "https://github.com/a2aproject/A2A/blob/main/specification/a2a.proto",
  "transports": [
    "JSON-RPC over HTTP",
    "gRPC",
    "HTTP+JSON (REST)"
  ],
  "encoding": "Protocol Buffers, mapped to JSON",
  "license": "Apache-2.0",
  "sdks": [
    "Python",
    "Go",
    "JavaScript",
    "Java",
    ".NET",
    "Rust"
  ],
  "related": [],
  "checked": "2026-10-18"
}
