{
  "id": "anp",
  "name": "Agent Network Protocol",
  "abbreviation": "ANP",
  "layer": "agent",
  "connects": "Agents on different domains, each with its own decentralized identity, to each other.",
  "author": "Gaowei Chang, ANP Open Source Community",
  "steward": "ANP Open Source Community",
  "status": "active",
  "version": "1.2",
  "released": "2026-09-24",
  "versioning": "major-minor",
  "spec": "https://agent-network-protocol.com/",
  "repository": "https://github.com/agent-network-protocol/AgentNetworkProtocol",
  "transports": [
    "HTTPS",
    "WebSocket (WSS)"
  ],
  "encoding": "JSON-LD descriptions, JSON-RPC 2.0 messages",
  "license": "Apache-2.0",
  "related": [
    {
      "id": "mcp",
      "relation": "uses"
    },
    {
      "id": "ap2",
      "relation": "uses"
    }
  ],
  "checked": "2026-10-18"
}
